{
  "source_id": "src_ted_search_api_v3",
  "name": "TED Search API v3 and official notice downloads",
  "owner": "Publications Office of the European Union",
  "jurisdiction": "European Union",
  "documentation_url": "https://docs.ted.europa.eu/api/latest/search.html",
  "licence_url": "https://ted.europa.eu/en/legal-notice",
  "access": {
    "mechanism": "API",
    "authentication": "NONE",
    "rate_limit_description": "The admitted AXIGNAL profile performs one fixed Search API request, one page and at most three active notices. Wider pagination and arbitrary expert queries are outside this admission.",
    "base_url": "https://api.ted.europa.eu/v3/notices/search"
  },
  "rights": {
    "collection": "PERMITTED",
    "transient_processing": "PERMITTED",
    "persistent_storage": "PERMITTED",
    "derived_calculations": "PERMITTED",
    "internal_display": "PERMITTED",
    "customer_display": "PERMITTED",
    "export": "PERMITTED",
    "api_redistribution": "PROHIBITED",
    "model_training": "PROHIBITED",
    "attribution_required": true,
    "retention_days": null,
    "notes": "Product admission is limited to the fixed non-personal Search API projection in ted-search-non-personal-projection@0.1.0. Procurement notices may be reused subject to source acknowledgement, indication of changes, non-distortion and additional rights. Contact data, protected logos, third-party protected material, arbitrary queries, API redistribution, bulk redistribution and model training are excluded.",
    "reviewed_at": "2026-07-29T14:49:00Z"
  },
  "freshness": {
    "expected_cadence": "Weekday OJ S publication; official TED daily XML package available by 09:30 on publication days according to the source help page.",
    "expected_delay_seconds": null,
    "stale_after_seconds": 172800,
    "expire_after_seconds": 604800
  },
  "reliability_tier": "PRIMARY_AUTHORITY",
  "lineage_group_id": "eu-ted-published-notices",
  "contains_personal_data": true,
  "contains_market_data": false,
  "parser_version": "ted-search-envelope@0.1.0",
  "operational_owner": "source-admission",
  "status": "PRODUCT_ADMITTED",
  "kill_switch_enabled": false,
  "created_at": "2026-07-29T09:24:00Z",
  "updated_at": "2026-07-29T14:49:00Z"
}
